{
  "$schema": "https://json-schema.org/draft/2020-12/schema",
  "$id": "https://cloverapps.ai/schemas/core/handoff/0.1.0/action-receipt-index.schema.json",
  "title": "Clover Handoff Action and Receipt Index 0.1.0",
  "type": "object",
  "additionalProperties": false,
  "required": ["documentType", "schemaVersion", "indexId", "createdAt", "previousIndexPath", "previousIndexHash", "entries", "indexHash"],
  "properties": {
    "documentType": { "const": "clover-handoff-action-receipt-index" },
    "schemaVersion": { "const": "0.1.0" },
    "indexId": { "$ref": "#/$defs/identifier" },
    "createdAt": { "$ref": "#/$defs/timestamp" },
    "previousIndexPath": { "type": ["string", "null"], "pattern": "^(?!/)(?!.*(?:^|/)\\.\\.(?:/|$))[A-Za-z0-9._*?\\[\\]{}/-]+$" },
    "previousIndexHash": { "type": ["string", "null"], "pattern": "^[a-f0-9]{64}$" },
    "entries": {
      "type": "array",
      "minItems": 1,
      "maxItems": 1000,
      "items": {
        "oneOf": [
          { "$ref": "#/$defs/completedEntry" },
          { "$ref": "#/$defs/pendingEntry" }
        ]
      }
    },
    "indexHash": { "$ref": "#/$defs/sha256" }
  },
  "$defs": {
    "identifier": {
      "type": "string",
      "minLength": 3,
      "maxLength": 160,
      "pattern": "^[a-z0-9][a-z0-9._:-]*$"
    },
    "timestamp": {
      "type": "string",
      "format": "date-time",
      "pattern": "^\\d{4}-\\d{2}-\\d{2}T\\d{2}:\\d{2}:\\d{2}(?:\\.\\d{3})?Z$"
    },
    "sha256": { "type": "string", "pattern": "^[a-f0-9]{64}$" },
    "reviewPending": {
      "type": "object",
      "additionalProperties": false,
      "required": ["status", "decisionId", "decisionPath", "decisionHash"],
      "properties": {
        "status": { "const": "pending" },
        "decisionId": { "const": null },
        "decisionPath": { "const": null },
        "decisionHash": { "const": null }
      }
    },
    "reviewCompleted": {
      "type": "object",
      "additionalProperties": false,
      "required": ["status", "decisionId", "decisionPath", "decisionHash"],
      "properties": {
        "status": { "const": "completed" },
        "decisionId": { "$ref": "#/$defs/identifier" },
        "decisionPath": { "$ref": "#/$defs/repositoryPath" },
        "decisionHash": { "$ref": "#/$defs/sha256" }
      }
    },
    "ownerApprovalNotRequired": {
      "type": "object",
      "additionalProperties": false,
      "required": ["status", "approverId", "approvedAt", "approvedEnvelopeHash", "approvalEvidenceHash", "attestationId", "attestationPath", "attestationHash"],
      "properties": {
        "status": { "const": "not-required" },
        "approverId": { "$ref": "#/$defs/identifier" },
        "approvedAt": { "const": null },
        "approvedEnvelopeHash": { "const": null },
        "approvalEvidenceHash": { "const": null },
        "attestationId": { "const": null },
        "attestationPath": { "const": null },
        "attestationHash": { "const": null }
      }
    },
    "ownerApprovalPending": {
      "type": "object",
      "additionalProperties": false,
      "required": ["status", "approverId", "approvedAt", "approvedEnvelopeHash", "approvalEvidenceHash", "attestationId", "attestationPath", "attestationHash"],
      "properties": {
        "status": { "const": "pending" },
        "approverId": { "$ref": "#/$defs/identifier" },
        "approvedAt": { "const": null },
        "approvedEnvelopeHash": { "const": null },
        "approvalEvidenceHash": { "const": null },
        "attestationId": { "const": null },
        "attestationPath": { "const": null },
        "attestationHash": { "const": null }
      }
    },
    "ownerApprovalApproved": {
      "type": "object",
      "additionalProperties": false,
      "required": ["status", "approverId", "approvedAt", "approvedEnvelopeHash", "approvalEvidenceHash", "attestationId", "attestationPath", "attestationHash"],
      "properties": {
        "status": { "const": "approved" },
        "approverId": { "$ref": "#/$defs/identifier" },
        "approvedAt": { "$ref": "#/$defs/timestamp" },
        "approvedEnvelopeHash": { "$ref": "#/$defs/sha256" },
        "approvalEvidenceHash": { "$ref": "#/$defs/sha256" },
        "attestationId": { "$ref": "#/$defs/identifier" },
        "attestationPath": { "$ref": "#/$defs/repositoryPath" },
        "attestationHash": { "$ref": "#/$defs/sha256" }
      }
    },
    "ownerApproval": {
      "oneOf": [
        { "$ref": "#/$defs/ownerApprovalNotRequired" },
        { "$ref": "#/$defs/ownerApprovalPending" },
        { "$ref": "#/$defs/ownerApprovalApproved" }
      ]
    },
    "consumedLifecycle": {
      "type": "object",
      "additionalProperties": false,
      "required": ["state", "singleUse", "consumedAt", "consumedByReceiptId", "revokedAt", "revocationEvidenceHash"],
      "properties": {
        "state": { "const": "consumed" },
        "singleUse": { "const": true },
        "consumedAt": { "$ref": "#/$defs/timestamp" },
        "consumedByReceiptId": { "$ref": "#/$defs/identifier" },
        "revokedAt": { "const": null },
        "revocationEvidenceHash": { "const": null }
      }
    },
    "pendingLifecycle": {
      "type": "object",
      "additionalProperties": false,
      "required": ["state", "singleUse", "consumedAt", "consumedByReceiptId", "revokedAt", "revocationEvidenceHash"],
      "properties": {
        "state": { "enum": ["available", "proposed", "revoked"] },
        "singleUse": { "const": true },
        "consumedAt": { "const": null },
        "consumedByReceiptId": { "const": null },
        "revokedAt": { "type": ["string", "null"], "format": "date-time" },
        "revocationEvidenceHash": { "type": ["string", "null"], "pattern": "^[a-f0-9]{64}$" }
      }
    },
    "completedEntry": {
      "type": "object",
      "additionalProperties": false,
      "required": [
        "sequence",
        "recordedAt",
        "actionId",
        "branchCapsuleId",
        "branchCapsuleHash",
        "envelopeId",
        "envelopePath",
        "envelopeHash",
        "status",
        "lifecycle",
        "ownerApproval",
        "receiptId",
        "receiptPath",
        "receiptHash",
        "outcome",
        "review"
      ],
      "properties": {
        "sequence": { "type": "integer", "minimum": 1 },
        "recordedAt": { "$ref": "#/$defs/timestamp" },
        "actionId": { "$ref": "#/$defs/actionId" },
        "branchCapsuleId": { "$ref": "#/$defs/identifier" },
        "branchCapsuleHash": { "$ref": "#/$defs/sha256" },
        "envelopeId": { "$ref": "#/$defs/identifier" },
        "envelopePath": { "$ref": "#/$defs/repositoryPath" },
        "envelopeHash": { "$ref": "#/$defs/sha256" },
        "status": { "const": "completed" },
        "lifecycle": { "$ref": "#/$defs/consumedLifecycle" },
        "ownerApproval": { "$ref": "#/$defs/ownerApproval" },
        "receiptId": { "$ref": "#/$defs/identifier" },
        "receiptPath": { "$ref": "#/$defs/repositoryPath" },
        "receiptHash": { "$ref": "#/$defs/sha256" },
        "outcome": { "enum": ["succeeded", "failed-closed", "blocked", "partial"] },
        "review": {
          "oneOf": [
            { "$ref": "#/$defs/reviewPending" },
            { "$ref": "#/$defs/reviewCompleted" }
          ]
        }
      }
    },
    "pendingEntry": {
      "type": "object",
      "additionalProperties": false,
      "required": [
        "sequence",
        "recordedAt",
        "actionId",
        "branchCapsuleId",
        "branchCapsuleHash",
        "envelopeId",
        "envelopePath",
        "envelopeHash",
        "status",
        "lifecycle",
        "ownerApproval",
        "receiptId",
        "receiptPath",
        "receiptHash",
        "outcome",
        "review"
      ],
      "properties": {
        "sequence": { "type": "integer", "minimum": 1 },
        "recordedAt": { "$ref": "#/$defs/timestamp" },
        "actionId": { "$ref": "#/$defs/actionId" },
        "branchCapsuleId": { "$ref": "#/$defs/identifier" },
        "branchCapsuleHash": { "$ref": "#/$defs/sha256" },
        "envelopeId": { "$ref": "#/$defs/identifier" },
        "envelopePath": { "$ref": "#/$defs/repositoryPath" },
        "envelopeHash": { "$ref": "#/$defs/sha256" },
        "status": { "const": "pending" },
        "lifecycle": { "$ref": "#/$defs/pendingLifecycle" },
        "ownerApproval": { "$ref": "#/$defs/ownerApproval" },
        "receiptId": { "const": null },
        "receiptPath": { "const": null },
        "receiptHash": { "const": null },
        "outcome": { "const": "pending" },
        "review": { "$ref": "#/$defs/reviewPending" }
      }
    },
    "actionId": { "type": "string", "pattern": "^CLOVER-\\d{4}-\\d{2}-\\d{2}-\\d{3}$" },
    "repositoryPath": {
      "type": "string",
      "minLength": 1,
      "maxLength": 500,
      "pattern": "^(?!/)(?!.*(?:^|/)\\.\\.(?:/|$))[A-Za-z0-9._*?\\[\\]{}/-]+$"
    }
  }
}
