{
  "createdAt": "2026-08-26T13:18:21.301Z",
  "documentType": "clover-handoff-action-receipt-index",
  "entries": [
    {
      "actionId": "CLOVER-2026-08-20-001",
      "branchCapsuleHash": "9284103f45dde81732d04eaee79f04625a38ca78272218d3f0610eeffffb45d5",
      "branchCapsuleId": "cell-capsule:clover-core:20260820",
      "envelopeHash": "0f246dfa000fee8c8f7b24a0e21075236fe05f1cc647736747f9f9df8cd4afba",
      "envelopeId": "handoff-action:001:status-refresh",
      "envelopePath": "portfolio/core/handoff/versions/0.1.0/demonstration/action-001-status-refresh-envelope.json",
      "lifecycle": {
        "consumedAt": "2026-08-20T21:19:44.000Z",
        "consumedByReceiptId": "handoff-receipt:001:status-refresh",
        "revocationEvidenceHash": null,
        "revokedAt": null,
        "singleUse": true,
        "state": "consumed"
      },
      "outcome": "succeeded",
      "ownerApproval": {
        "approvalEvidenceHash": null,
        "approvedAt": null,
        "approvedEnvelopeHash": null,
        "approverId": "owner:chris-dortch",
        "attestationHash": null,
        "attestationId": null,
        "attestationPath": null,
        "status": "not-required"
      },
      "receiptHash": "85a80a7aea223d2317477e6975a9f1a34bd5fed8ba2f1f1e48edf2e742a6f3d8",
      "receiptId": "handoff-receipt:001:status-refresh",
      "receiptPath": "portfolio/core/handoff/versions/0.1.0/demonstration/action-001-status-refresh-receipt.json",
      "recordedAt": "2026-08-20T21:19:45.000Z",
      "review": {
        "decisionHash": null,
        "decisionId": null,
        "decisionPath": null,
        "status": "pending"
      },
      "sequence": 1,
      "status": "completed"
    },
    {
      "actionId": "CLOVER-2026-08-20-002",
      "branchCapsuleHash": "37e2487a27143900e66cc69cd0bd8fe1ae44e4cf3fef5ad1d57a69636e0df97d",
      "branchCapsuleId": "cell-capsule:clover-warroom:20260820",
      "envelopeHash": "71873de93355ec1301b2a398b34d72860339f19f52c937fffdc3c95638550214",
      "envelopeId": "handoff-action:002:warroom-identity",
      "envelopePath": "portfolio/core/handoff/versions/0.1.0/demonstration/action-002-warroom-identity-envelope.json",
      "lifecycle": {
        "consumedAt": null,
        "consumedByReceiptId": null,
        "revocationEvidenceHash": null,
        "revokedAt": null,
        "singleUse": true,
        "state": "proposed"
      },
      "outcome": "pending",
      "ownerApproval": {
        "approvalEvidenceHash": null,
        "approvedAt": null,
        "approvedEnvelopeHash": null,
        "approverId": "owner:chris-dortch",
        "attestationHash": null,
        "attestationId": null,
        "attestationPath": null,
        "status": "pending"
      },
      "receiptHash": null,
      "receiptId": null,
      "receiptPath": null,
      "recordedAt": "2026-08-20T21:19:45.000Z",
      "review": {
        "decisionHash": null,
        "decisionId": null,
        "decisionPath": null,
        "status": "pending"
      },
      "sequence": 2,
      "status": "pending"
    },
    {
      "actionId": "CLOVER-2026-08-24-004",
      "branchCapsuleHash": "7c859ee6ad9330e7f42b78467236948280b1765e7c045b4d0dc17e4753d6e2d4",
      "branchCapsuleId": "cell-capsule:clover-launch-studio-private-owner:20260824",
      "envelopeHash": "7649ec03c472306c1e3de93c08b11665debb4e095ece4aa9d4da2c2d357ca420",
      "envelopeId": "handoff-action:004:launch-studio-phase-b-source",
      "envelopePath": "portfolio/core/handoff/versions/0.1.0/proposals/launch-studio-phase-b-0.2a/action-004-source-envelope.json",
      "lifecycle": {
        "consumedAt": null,
        "consumedByReceiptId": null,
        "revocationEvidenceHash": "3b496dde58ed6c5a27f732620db7acc1ad7b3d58fb5aec15da9c76851d5c2f04",
        "revokedAt": "2026-08-24T22:30:28.000Z",
        "singleUse": true,
        "state": "revoked"
      },
      "outcome": "pending",
      "ownerApproval": {
        "approvalEvidenceHash": null,
        "approvedAt": null,
        "approvedEnvelopeHash": null,
        "approverId": "owner:chris-dortch",
        "attestationHash": null,
        "attestationId": null,
        "attestationPath": null,
        "status": "pending"
      },
      "receiptHash": null,
      "receiptId": null,
      "receiptPath": null,
      "recordedAt": "2026-08-24T22:30:28.000Z",
      "review": {
        "decisionHash": null,
        "decisionId": null,
        "decisionPath": null,
        "status": "pending"
      },
      "sequence": 3,
      "status": "pending"
    },
    {
      "actionId": "CLOVER-2026-08-24-005",
      "branchCapsuleHash": "7c859ee6ad9330e7f42b78467236948280b1765e7c045b4d0dc17e4753d6e2d4",
      "branchCapsuleId": "cell-capsule:clover-launch-studio-private-owner:20260824",
      "envelopeHash": "cc1626a1d8e2bbc77ee64352a4521d9a8394a66bfbb70d43bcf5662aff28ce44",
      "envelopeId": "handoff-action:005:launch-studio-phase-b-source",
      "envelopePath": "portfolio/core/handoff/versions/0.1.0/proposals/launch-studio-phase-b-0.2b/action-005-source-envelope.json",
      "lifecycle": {
        "consumedAt": null,
        "consumedByReceiptId": null,
        "revocationEvidenceHash": "322ca206e0eaceb983067d64132e0a380b5105c67d724fdcb9a81a036ae355dc",
        "revokedAt": "2026-08-25T00:30:18.000Z",
        "singleUse": true,
        "state": "revoked"
      },
      "outcome": "pending",
      "ownerApproval": {
        "approvalEvidenceHash": null,
        "approvedAt": null,
        "approvedEnvelopeHash": null,
        "approverId": "owner:chris-dortch",
        "attestationHash": null,
        "attestationId": null,
        "attestationPath": null,
        "status": "pending"
      },
      "receiptHash": null,
      "receiptId": null,
      "receiptPath": null,
      "recordedAt": "2026-08-25T00:30:18.000Z",
      "review": {
        "decisionHash": null,
        "decisionId": null,
        "decisionPath": null,
        "status": "pending"
      },
      "sequence": 4,
      "status": "pending"
    },
    {
      "actionId": "CLOVER-2026-08-24-006",
      "branchCapsuleHash": "7c859ee6ad9330e7f42b78467236948280b1765e7c045b4d0dc17e4753d6e2d4",
      "branchCapsuleId": "cell-capsule:clover-launch-studio-private-owner:20260824",
      "envelopeHash": "d1bd1b261cfa0b7c52b5cd7bb69058f2011d526ec874492a2253255ce65d9965",
      "envelopeId": "handoff-action:006:launch-studio-phase-b-source",
      "envelopePath": "portfolio/core/handoff/versions/0.1.0/proposals/launch-studio-phase-b-0.2c/action-006-source-envelope.json",
      "lifecycle": {
        "consumedAt": "2026-08-25T17:03:19.984Z",
        "consumedByReceiptId": "handoff-receipt:006:launch-studio-phase-b-source",
        "revocationEvidenceHash": null,
        "revokedAt": null,
        "singleUse": true,
        "state": "consumed"
      },
      "outcome": "succeeded",
      "ownerApproval": {
        "approvalEvidenceHash": "df16607a0e2f00d3e94ff05949314fe005e1ff4ae57f7016f1c9c20b7374d53c",
        "approvedAt": "2026-08-25T13:21:54.804Z",
        "approvedEnvelopeHash": "d1bd1b261cfa0b7c52b5cd7bb69058f2011d526ec874492a2253255ce65d9965",
        "approverId": "owner:chris-dortch",
        "attestationHash": "988704658b9deecd6e343147f14bf69e054a218c63e9af140063d7cf85d7983d",
        "attestationId": "handoff-approval:006:launch-studio-phase-b-source",
        "attestationPath": "portfolio/core/handoff/versions/0.1.0/approvals/action-006-launch-studio-phase-b-source-approval.json",
        "status": "approved"
      },
      "receiptHash": "d57da7f0ac78121f42e7f7d9363c7a7a65a5e73bd3df06c1ec905530b5f4bbf5",
      "receiptId": "handoff-receipt:006:launch-studio-phase-b-source",
      "receiptPath": "portfolio/core/handoff/versions/0.1.0/receipts/action-006-launch-studio-phase-b-source-receipt.json",
      "recordedAt": "2026-08-26T13:18:21.301Z",
      "review": {
        "decisionHash": "d5e11599f495b98398766a7c55f2cac26ed46c285aa878fcdc552533597297cb",
        "decisionId": "handoff-review:006:connector-scope-hold",
        "decisionPath": "portfolio/core/handoff/versions/0.1.0/reviews/action-006-launch-studio-phase-b-source-review.json",
        "status": "completed"
      },
      "sequence": 5,
      "status": "completed"
    }
  ],
  "indexId": "handoff-index:launch-studio-action-006-review-held",
  "previousIndexHash": "99e53c2313389531864bf62095fd91f1c1c8d4ba5618267b6d361ca5a79664b1",
  "previousIndexPath": "portfolio/core/handoff/versions/0.1.0/indexes/action-receipt-index-0006.json",
  "schemaVersion": "0.1.0",
  "indexHash": "b68af5df24f964eb6dabcd3f429a11bcd862de2a893d1ac74a6a74f7c78fc4ce"
}
