{"createdAt":"2026-08-24T22:30:28.000Z","documentType":"clover-handoff-action-receipt-index","entries":[{"actionId":"CLOVER-2026-08-20-001","branchCapsuleHash":"9284103f45dde81732d04eaee79f04625a38ca78272218d3f0610eeffffb45d5","branchCapsuleId":"cell-capsule:clover-core:20260820","envelopeHash":"0f246dfa000fee8c8f7b24a0e21075236fe05f1cc647736747f9f9df8cd4afba","envelopeId":"handoff-action:001:status-refresh","envelopePath":"portfolio/core/handoff/versions/0.1.0/demonstration/action-001-status-refresh-envelope.json","lifecycle":{"consumedAt":"2026-08-20T21:19:44.000Z","consumedByReceiptId":"handoff-receipt:001:status-refresh","revocationEvidenceHash":null,"revokedAt":null,"singleUse":true,"state":"consumed"},"outcome":"succeeded","ownerApproval":{"approvalEvidenceHash":null,"approvedAt":null,"approvedEnvelopeHash":null,"approverId":"owner:chris-dortch","attestationHash":null,"attestationId":null,"attestationPath":null,"status":"not-required"},"receiptHash":"85a80a7aea223d2317477e6975a9f1a34bd5fed8ba2f1f1e48edf2e742a6f3d8","receiptId":"handoff-receipt:001:status-refresh","receiptPath":"portfolio/core/handoff/versions/0.1.0/demonstration/action-001-status-refresh-receipt.json","recordedAt":"2026-08-20T21:19:45.000Z","review":{"decisionHash":null,"decisionId":null,"decisionPath":null,"status":"pending"},"sequence":1,"status":"completed"},{"actionId":"CLOVER-2026-08-20-002","branchCapsuleHash":"37e2487a27143900e66cc69cd0bd8fe1ae44e4cf3fef5ad1d57a69636e0df97d","branchCapsuleId":"cell-capsule:clover-warroom:20260820","envelopeHash":"71873de93355ec1301b2a398b34d72860339f19f52c937fffdc3c95638550214","envelopeId":"handoff-action:002:warroom-identity","envelopePath":"portfolio/core/handoff/versions/0.1.0/demonstration/action-002-warroom-identity-envelope.json","lifecycle":{"consumedAt":null,"consumedByReceiptId":null,"revocationEvidenceHash":null,"revokedAt":null,"singleUse":true,"state":"proposed"},"outcome":"pending","ownerApproval":{"approvalEvidenceHash":null,"approvedAt":null,"approvedEnvelopeHash":null,"approverId":"owner:chris-dortch","attestationHash":null,"attestationId":null,"attestationPath":null,"status":"pending"},"receiptHash":null,"receiptId":null,"receiptPath":null,"recordedAt":"2026-08-20T21:19:45.000Z","review":{"decisionHash":null,"decisionId":null,"decisionPath":null,"status":"pending"},"sequence":2,"status":"pending"},{"actionId":"CLOVER-2026-08-24-004","branchCapsuleHash":"7c859ee6ad9330e7f42b78467236948280b1765e7c045b4d0dc17e4753d6e2d4","branchCapsuleId":"cell-capsule:clover-launch-studio-private-owner:20260824","envelopeHash":"7649ec03c472306c1e3de93c08b11665debb4e095ece4aa9d4da2c2d357ca420","envelopeId":"handoff-action:004:launch-studio-phase-b-source","envelopePath":"portfolio/core/handoff/versions/0.1.0/proposals/launch-studio-phase-b-0.2a/action-004-source-envelope.json","lifecycle":{"consumedAt":null,"consumedByReceiptId":null,"revocationEvidenceHash":"3b496dde58ed6c5a27f732620db7acc1ad7b3d58fb5aec15da9c76851d5c2f04","revokedAt":"2026-08-24T22:30:28.000Z","singleUse":true,"state":"revoked"},"outcome":"pending","ownerApproval":{"approvalEvidenceHash":null,"approvedAt":null,"approvedEnvelopeHash":null,"approverId":"owner:chris-dortch","attestationHash":null,"attestationId":null,"attestationPath":null,"status":"pending"},"receiptHash":null,"receiptId":null,"receiptPath":null,"recordedAt":"2026-08-24T22:30:28.000Z","review":{"decisionHash":null,"decisionId":null,"decisionPath":null,"status":"pending"},"sequence":3,"status":"pending"},{"actionId":"CLOVER-2026-08-24-005","branchCapsuleHash":"7c859ee6ad9330e7f42b78467236948280b1765e7c045b4d0dc17e4753d6e2d4","branchCapsuleId":"cell-capsule:clover-launch-studio-private-owner:20260824","envelopeHash":"cc1626a1d8e2bbc77ee64352a4521d9a8394a66bfbb70d43bcf5662aff28ce44","envelopeId":"handoff-action:005:launch-studio-phase-b-source","envelopePath":"portfolio/core/handoff/versions/0.1.0/proposals/launch-studio-phase-b-0.2b/action-005-source-envelope.json","lifecycle":{"consumedAt":null,"consumedByReceiptId":null,"revocationEvidenceHash":null,"revokedAt":null,"singleUse":true,"state":"proposed"},"outcome":"pending","ownerApproval":{"approvalEvidenceHash":null,"approvedAt":null,"approvedEnvelopeHash":null,"approverId":"owner:chris-dortch","attestationHash":null,"attestationId":null,"attestationPath":null,"status":"pending"},"receiptHash":null,"receiptId":null,"receiptPath":null,"recordedAt":"2026-08-24T22:30:28.000Z","review":{"decisionHash":null,"decisionId":null,"decisionPath":null,"status":"pending"},"sequence":4,"status":"pending"}],"indexHash":"915ae90d41f8fff62681c213f230424d2a7e86049d362081883f276562ca3115","indexId":"handoff-index:launch-studio-phase-b-action-005-proposed:20260824","previousIndexHash":"80cf1221d705eb7c62f50e2d9e63f849d82a42bc35365b3f730975bdff5729a9","previousIndexPath":"portfolio/core/handoff/versions/0.1.0/indexes/action-receipt-index-0002.json","schemaVersion":"0.1.0"}
